,ProductName,ProductDescription,ProductIngredients,ProductPrice,href
22,La Roche-Posay Anthelios XL Wet Skin SPF50+ 250ml,"La Roche-Posay® Anthelios Wet Skin SPF50+ Body Sunscreen is a broad-spectrum lotion with the highest* UVA/UVB proteciton. *Tested AS/NZS 2604.2012  Anthelios Wet Skin SPF50+ Body Sunscreen is a broad-spectrum sunscreen lotion is suitable for the entire family. With the highest* UVA/UVB protection, this formula is tested under dermatological and paediatric control for an ultra-safe formula.This innovative Wet Skin Techonology allows for SPF protection to be maintained, even when applied directly to wet skin due to an hydrophobic film on the skin to help repel water. SPF Protection maintained even when applied on wet skin.4 hours water-resistant.Featuring an invisble lotion texture that is instantly absorbed into the skin, this formula contains no white marks. Non-greasy, non-sticky and no white marks when applied to wet skin.Contains La Roche-Posay Thermal Spring Water with natural antioxidants to soothe senstiive skin and Glycerin to keep skin hydrated. ALWAYS READ THE LABEL, FOLLOW DIRECTIONS FOR USE.*Tested to AS/NZS 2604:2012; ""Very High"" Protection. Suitable For:  Sensitive Skin Size:  250ml Hypo Allergenic?:  Yes KEY FEATURES  • Hightest* UVA/UVB protection. • Designed for childern's sensitive skin. Suitable for the entire family. • Ultra-safe formula, tested under dermatological and paediatric control. • With NEW Wet Skin Technology which allows SPF protection to be maintained, even when applied to wet skin. • Featuring an non-greasy, non-sticky lotion texture that instantly absorbs into the skin. • 4 hours water-resistant. • Contains La Roche-Posay Thermal Spring Water and Glycerin. • Packaged in a sleek, easy-to-use tube.","Ingredients
Active Ingredients: Homosalate 10.0%W/WDrometrizole Trisiloxane 5.0%W/WOctyl Salicylate 5.0%W/WBemotrizinol 4.5%W/WEthylhexyl Triazone 3.5%W/WButyl Methoxydibenzoylmethane 3.5%W/W Aqua/Water, Homosalate, Drometizole Trisiloxane, Ethylhexyl Salicylate, Bis-Ethylhexyloxyphenol Methoxyphenyl Triazine, Ethylexyl Triazone, Glycerin, Butyl Methoxydibenzoylmethane, Isohexadecane, Alcohol Denat., Propanediol, Dicaprylyl Ether, Styrene/Acrylates Copolymer, Dimethicone, Acrylates/Dimethicone Copolymer, P-Anisic Acid, Ascorbyl Palmitate, Carbomer, Disodium Edta, Glyceryloleate, Hydrogenated Palm Glycerides Citrate, Lecithin, Nylon-12, Peg-8 Laurate, Phenoxyethanol, Tocopherol, TriethanolaminePlease be aware that ingredient lists for the products of our brand are updated regularly. Please refer to the ingredient list on your product package for the most up to date list of ingredients to ensure it is suitable to your personal use.",$29.99$12.96 Off RRP!,https://www.chemistwarehouse.com.au/buy/93032/la-roche-posay-anthelios-xl-wet-skin-spf50-250ml
23,La Roche Posay Hyalu B5 Eye Serum 15ml,"Introducing La Roche-Posay's NEW Hyalu B5 Hyaluronic Acid Eye Serum - our first anti-wrinkle solution to intensely hydrate and re-plump the eye area and visibly correct dark circles. Our unique formula features two types of pure hyaluronic acid, vitamin B5, and a 10% dermatological eye complex containing caffeine, niacinamide, and Hepes.Formulated to re-plump the appearance of wrinkles and visibly correct dark circles for a more youthful and radiant look.  Our dermatological hydrating and repairing eye serum is designed to target wrinkles and fine lines, loss of volume and elasticity, and tired-looking skin. While suitable for all skin types, it is specifically formulated for those with sensitive skin and is safe for contact lens wearers.  Eye Contour is immediately hydrated. At 2 weeks eyes look more open, fine lines and wrinkles are reduced and dark circles appear less visible. Eye contour looks revitalised and feels firmer.  For the optimal skin routine repair and re-plump with the Hyalu B5 Hyaluronic Acid Serum, correct dark circles with the Hyalu B5 Hyaluronic Acid Eye Serum and protect with our Anthelios Invisible Fluid Facial Sunscreen*   Validity after opening: 6 months. Always check the manufacturer instructions.ALWAYS READ THE LABEL AND FOLLOW THE DIRECTIONS FOR USE.Apply 20 minutes before sun exposure. Sunscreen is only one part of sun protection so wearprotective clothing and seek shade. Avoid prolonged sun exposure. Reapply every 2 hours and afterswimming, towelling and perspiring in accordance with directions. No.1 Dermatologist Recommended Skincare Brand in Australia* *AplusA Healthcare Market Research2, Dermatologist barometer survey, Australian dermocosmetic market, January-May 2022. Suitable For:  For all skin types, it is specifically formulated for those with sensitive skin and is safe for contact lens wearers. Product Claims:  Hydrate: Eye Contour is immediately hydrated Re-plump and Repair : At 2 weeks eyes look more open, fine lines and wrinkles are reduced and dark circles appear less visible Repair and soothe:The eye contour looks revitalized and feels firmer Visible dark circles correction* at 2 weeks Correct wrinkles* at 2 weeks 80% eye contour feels firmer* at 2 weeks *Cosmeto-clinical study on 82 subjects Size:  15mL Skin Type:  Sensitive KEY FEATURES  • The eye contour looks revitalized and feels firmer • 1H moisture barrier repair* *Instrumental test, 24 subjects • Replumps in 4H* *Instrumental test, 24 subjects • Visible correction at 2 weeks* *Cosmeto-clinical scoring, 81 subjects • 81% agree crow's feet wrinkles look plumper* *Cosmetico-clinical study, 81 women, usage, twice per day, for 6 weeks.","Ingredients
2039097 03INGREDIENTS: AQUA /WATER / EAU •  GLYCERIN •  HYDROXYETHYLPIPERAZINE ETHANE SULFONIC ACID •  NIACINAMIDE •  PENTYLENE GLYCOL •  PANTHENOL •  SODIUM HYALURONATE •  CAFFEINE •  ASCORBYL GLUCOSIDE •  HYDROXYACETOPHENONE • CAPRYLYL GLYCOL •  CITRIC ACID •  TRISODIUM ETHYLENEDIAMINE DISUCCINATE (CODE F.I.L: N70017601/1)N70017601/1Please be aware that ingredient lists for the products of our brand are updated regularly. Please refer to the ingredient list on your product package for the most up to date list of ingredients to ensure it is suitable to your personal use.",$38.39$16.61 Off RRP!,https://www.chemistwarehouse.com.au/buy/124198/la-roche-posay-hyalu-b5-eye-serum-15ml
24,La Roche Posay Effaclar Ultra Concentrate Serum 30ml,"Anti-wrinkle & anti-acne daily face serum  Effaclar Ultra Concentrated Serum 30mL is a Salicylic Acid daily serum that helps to visibly reduce the appearance of breakouts, blemishes and imperfections. This anti marks, anti-imperfection serum for acne prone skin and wrinkles is formulated with 3 complimentary peeling acids; -	LHA, to micro-exfoliate and refine pores, -	Salicylic Acid, to unclog pores and help clear imperfections, and -	Anti-bacterial glycolic acid for anti-redness. Tackle imperfections head on with an anti-wrinkle serum that works to visibly minimise the appearance of fine lines and wrinkles, while simultaneously tackling the formation of breakouts. The Effaclar Serum for acne-prone skin has a fast-absorbing texture and non-sticky finish, ideal for the subsequent application of a facial moisturiser. KEY INGREDIENTS LHA: Micro-exfoliates and gently lifts dead skin cells, refining pores for a smoother complexion. LHA works with other ingredients to visibly improve existing pimples, and reduce future breakouts. SALICYLIC ACID: Exfoliates surface cells and helps reduce sebum production for visibly clearer skin. Salicylic Acid works to unclog pores to clear existing imperfections, as well as simultaneously helping to prevent new breakouts from forming. GLYCOLIC ACID: Provides anti-bacterial properties to help prevent new breakouts in the skin, as well as manage redness. Glycolic acid exfoliates dead skin cells to improve overall skin clarity, visibly improving texture for a more even skin tone. Ingredients: Aqua/Water/Eau, Alcohol Denat., Propanediol, Glycolic Acid, Niacinamide, Dimethyl Isosorbide, Pentylene Glycol, Salicylic Acid, Sodium Hydroxide, Peg-60 Hydrogenated Castor Oil, Hydroxyethylpiperazine Ethan Sulfonic Acid, Citric Acid, Peg-30 Glyceryl Cocoate, Capryloyl Salicylic Acid, Biosaccharide Gum-1, Maltodextrin, Phytic Acid, Polyquaternium-10, Parfum/Fragrance (B253157/1) Please be aware that ingredient lists for the products of our brand are updated regularly. Please refer to the ingredient list on your product package for the most up to date list of ingredients to ensure it is suitable to your personal use. Size:  30ml Fragrance:  NA KEY FEATURES  • Helps to visibly reduce the appearance of breakouts, blemishes and imperfections • Visibly minimises the appearance of fine lines and wrinkles • Tackles the formation of breakouts • Fast-absorbing texture • Non-sticky finish","Ingredients
2039007 100 - INGREDIENTS: AQUA / WATER / EAU •  ALCOHOL DENAT. •  PROPANEDIOL •  GLYCOLIC ACID •  NIACINAMIDE •  DIMETHYL ISOSORBIDE •  PENTYLENE GLYCOL •  SALICYLIC ACID •  SODIUM HYDROXIDE •  PPG-26-BUTETH-26 •  HYDROXYETHYLPIPERAZINE ETHANE SULFONIC ACID •  CITRIC ACID •  PEG-30 GLYCERYL COCOATE •  PEG-40 HYDROGENATED CASTOR OIL •  PEG-60 HYDROGENATED CASTOR OIL •  CAPRYLOYL SALICYLIC ACID •  BIOSACCHARIDE GUM-1 •  MALTODEXTRIN •  PHYTIC ACID •  POLYQUATERNIUM-10 •  PARFUM / FRAGRANCE (F.I.L. N286692/1).Please be aware that ingredient lists for the products of our brand are updated regularly. Please refer to the ingredient list on your product package for the most up to date list of ingredients to ensure it is suitable to your personal use.",$41.99$17.96 Off RRP!,https://www.chemistwarehouse.com.au/buy/107763/la-roche-posay-effaclar-ultra-concentrate-serum-30ml
25,La Roche-Posay Redermic R Anti-Ageing Eye Cream 15ml,"Retinol eye cream for sensitive eyes  Redermic R Anti-Ageing Eye Cream 15mL is an anti-ageing eye cream that contains a complex of pure and slow release retinol to visibly smooth skin around the eye area. The delicate skin around the eye is often the first to show signs of ageing, so this Redermic R eye cream formula is designed to target these - including signs of photo-ageing, signs of fatigue, wrinkles around the eye contour, and dark circles. The exclusive retinol complex in Redermic R Anti-Ageing Eye Cream provides a skin smoothing action, and combines this with caffeine for an anti-ageing and lifting effect. The formula is also suitable for those with sensitive skin around the eyes. This anti-ageing eye cream has an ultra-fluid, non-sticky texture, which melts into the skin on application so it can be used before makeup application. Key Ingredient: ZINC SULFATE: Anti-sebum properties, Astringent properties. Ingredients: AQUA / WATER •  GLYCERIN •  CYCLOHEXASILOXANE •  ALCOHOL DENAT •  PENTYLENE GLYCOL •  NIACINAMIDE •  DIMETHICONE •  GLYCINE SOJA OIL / SOYBEAN OIL •  PPG-6-DECYLTETRADECETH-30 •  SODIUM HYALURONATE RETINOL •  ADENOSINE •  AMMONIUM POLYACRYLOYLDIMETHYL •  TAURATE •  CAPRYLYL GLYCOL •  CITRIC ACID •  TRISODIUM ETHYLENEDIAMINE DISUCCINATE •  XANTHAN GUM •  POLYS ILICONE-11 •  RETINYL PALMITATE TOCOPHEROL •  PHENOXYETHANOL •  PARFUM / FRAGRANCE. (B244835/1) Please be aware that ingredient lists for the products of our brand are updated regularly. Please refer to the ingredient list on your product package for the most up to date list of ingredients to ensure it is suitable to your personal use. Size:  15ml Fragrance:  NA KEY FEATURES  • Specifically made for sensitive eyes and visibly reduces wrinkles • Firms the skin • Evens the complexion • Deep wrinkles • Smoothing","Ingredients
609826 20 - INGREDIENTS: AQUA / WATER / EAU •  ISOCETYL STEARATE •  GLYCERIN •  OCTYLDODECANOL •  PENTYLENE GLYCOL •  DIMETHICONE •  PROPYLENE GLYCOL •  CETEARYL ALCOHOL •  GLYCINE SOJA OIL / SOYBEAN OIL •  CARRAGEENAN •  SORBITAN OLEATE •  DIMETHICONE/VINYL DIMETHICONE CROSSPOLYMER •  CAFFEINE •  ISOHEXADECANE •  SODIUM HYALURONATE •  SODIUM POLYACRYLATE •  RETINOL •  ADENOSINE •  POLOXAMER 338 •  AMMONIUM POLYACRYLOYLDIMETHYL TAURATE •  CAPRYLYL GLYCOL •  CITRIC ACID •  XANTHAN GUM •  POLYSORBATE 80 •  ACRYLAMIDE/SODIUM ACRYLOYLDIMETHYLTAURATE COPOLYMER •  BHT •  RETINYL PALMITATE •  TOCOPHEROL •  PHENOXYETHANOL (F.I.L. B248978/1).Please be aware that ingredient lists for the products of our brand are updated regularly. Please refer to the ingredient list on your product package for the most up to date list of ingredients to ensure it is suitable to your personal use.",$33.99$14.96 Off RRP!,https://www.chemistwarehouse.com.au/buy/78837/la-roche-posay-redermic-r-anti-ageing-eye-cream-15ml
26,La Roche-Posay Serozinc Toning Mist 150ml,"Serozinc facial mist is perfectly used as a toner to target oily, acne prone skin. It's a simple and effective solution to reduce excess shine every day and helps to tighten the appearance of pores.  Sensitive and reactive skin. Gently cleanses and soothes reactive skin. Micellar technology achieves improved performance from the first cotton pad. Contains a boosted concentration of glycerin for optimal comfort and hydrating power. A minimalist formulation contains 0% soap, colourants or fragrance. Removes make-up, impurities and dirt. Leaves the skin clean without drying. Suitable For:  Sensitive Skin Recommended By:  Dermatologists Size:  150mL Hypo Allergenic?:  Yes KEY FEATURES  • Make-up removal for the sensitive skin on the face, eyes and lips • Respecting their physiological balance • Hypoallergenic • Dermatologically tested on sensitive skin • Dermatologically tested for sensitive skin","Ingredients
Ingredients: Aqua / Water, Sodium Chloride, Zinc Sulfate, (Fil Code: B2143/11)Please be aware that ingredient lists for the products of our brand are updated regularly. Please refer to the ingredient list on your product package for the most up to date list of ingredients to ensure it is suitable to your personal use.",$19.39$8.56 Off RRP!,https://www.chemistwarehouse.com.au/buy/78839/la-roche-posay-serozinc-toning-mist-150ml
27,La Roche-Posay Uvidea XL BB Cream Shade Medium 30ml,"BB cream sunscreen for sensitive skin  Uvidea BB Cream SPF50+ is a sun care BB Cream that instantly covers imperfections while preventing hyperpigmentation. It is a preventing cream with corrective care against UVB, UVA, long-UV, and pollution. Light and hydrating, it easily melts into skin for a soft-touch finish. The formula is non-oily, has long-lasting wear and contains La Roche-Posay Thermal Spring Water. Available in 3 shades: • 	01 Light - For very light tinted coverage suitable for light, porcelain, and ivory skin tones • 	02 Medium - For medium tint, warm skin tones • 	03 Fair - Tinted cover for fair skin tones The Science Behind: • 	Against UV Rays: Enhanced anti-UVA/UVB filtering system with Mexoryl SX + protecting up to long UVA. • 	Against Pollution Induced Oxidative Stress: A powerful antioxidant complex enriched with Venuceane, an extract from a micro-organism able to survive in extreme environments (high temperature, lack of oxygen, etc.). Key Ingredients: • 	Mexoryl XL Filtering System: La Roche-Posay's special UV filtering system that against UVA, UVB and Long-UVA • 	Carnosine & Vitamin E: A powerful antioxidant complex to help safeguard cells from free-radicals induced by environmental aggressions. • 	La Roche-Posay Thermal Water: Calms and reduces skin irritation. Ingredients: AQUA / WATER •  CI 77891 / TITANIUM DIOXIDE •  ETHYLHEXYL METHOXYCINNAMATE •  GLYCERIN •  DROMETRIZOLE TRISILOXANE •  DIMETHICONE •  ALCOHOL DENAT. •  TITANIUM DIOXIDE •  TEREPHTHALYLIDENE DICAMPHOR SULFONIC ACID •  PROPYLENE GLYCOL •  DIETHYLAMINO HYDROXYBENZOYL HEXYL BENZOATE •  TRIETHANOLAMINE •  CI 77491, CI 77492, CI 77499 / IRON OXIDES •  BIS-ETHYLHEXYLOXYPHENOL METHOXYPHENYL TRIAZINE •  STEARIC ACID •  POTASSIUM CETYL PHOSPHATE •  PENTYLENE GLYCOL •  ALUMINUM HYDROXIDE •  BHT •  BUTYLENE GLYCOL •  BUTYROSPERMUM PARKII SEEDCAKE EXTRACT / SHEA BUTTER SEEDCAKE EXTRACT •  CAPRYLYL GLYCOL •  CARBOMER •  CARNOSINE •  CETYL ALCOHOL •  DISODIUM EDTA •  GLYCERYL STEARATE •  MYRISTIC ACID •  MYRISTYL ALCOHOL •  PALMITIC ACID •  PEG-100 STEARATE •  PHENOXYETHANOL •  SODIUM CHLORIDE •  SODIUM COCOYL SARCOSINATE •  STEARYL ALCOHOL •  TOCOPHEROL •  TROMETHAMINE •  XANTHAN GUM. (C180045/1) Please be aware that ingredient lists for the products of our brand are updated regularly. Please refer to the ingredient list on your product package for the most up to date list of ingredients to ensure it is suitable to your personal use. Size:  30ml Fragrance:  NA KEY FEATURES  • Instantly covers imperfections • Prevents hyperpigmentation • Preventing & corrective care against UVB, UVA, long-UV, and pollution • Light and hydrating, it easily melts into skin • Non oily","Ingredients
884771 2 - INGREDIENTS: AQUA / WATER •  CI 77891 / TITANIUM DIOXIDE •  ETHYLHEXYL METHOXYCINNAMATE •  GLYCERIN •  DROMETRIZOLE TRISILOXANE •  DIMETHICONE •  ALCOHOL DENAT. •  TITANIUM DIOXIDE •  TEREPHTHALYLIDENE DICAMPHOR SULFONIC ACID •  PROPYLENE GLYCOL •  DIETHYLAMINO HYDROXYBENZOYL HEXYL BENZOATE •  TRIETHANOLAMINE •  CI 77491, CI 77492, CI 77499 / IRON OXIDES •  BIS-ETHYLHEXYLOXYPHENOL METHOXYPHENYL TRIAZINE •  STEARIC ACID •  POTASSIUM CETYL PHOSPHATE •  PENTYLENE GLYCOL •  ALUMINUM HYDROXIDE •  BHT •  BUTYLENE GLYCOL •  BUTYROSPERMUM PARKII SEEDCAKE EXTRACT / SHEA BUTTER SEEDCAKE EXTRACT •  CAPRYLYL GLYCOL •  CARBOMER •  CARNOSINE •  CETYL ALCOHOL •  DISODIUM EDTA •  GLYCERYL STEARATE •  MYRISTIC ACID •  MYRISTYL ALCOHOL •  PALMITIC ACID •  PEG-100 STEARATE •  PHENOXYETHANOL •  SODIUM CHLORIDE •  SODIUM COCOYL SARCOSINATE •  STEARYL ALCOHOL •  TOCOPHEROL •  TROMETHAMINE •  XANTHAN GUM (F.I.L. C180045/1).Please be aware that ingredient lists for the products of our brand are updated regularly. Please refer to the ingredient list on your product package for the most up to date list of ingredients to ensure it is suitable to your personal use.",$26.99$11.96 Off RRP!,https://www.chemistwarehouse.com.au/buy/78852/la-roche-posay-uvidea-xl-bb-cream-shade-medium-30ml
28,La Roche-Posay Uvidea XL BB Cream Shade Light 30ml,"BB cream sunscreen for sensitive skin  Uvidea BB Cream SPF50+ is a sun care BB Cream that instantly covers imperfections while preventing hyperpigmentation. It is a preventing cream with corrective care against UVB, UVA, long-UV, and pollution. Light and hydrating, it easily melts into skin for a soft-touch finish. The formula is non-oily, has long-lasting wear and contains La Roche-Posay Thermal Spring Water. Available in 3 shades: • 	01 Light - For very light tinted coverage suitable for light, porcelain, and ivory skin tones • 	02 Medium - For medium tint, warm skin tones • 	03 Fair - Tinted cover for fair skin tones The Science Behind: • 	Against UV Rays: Enhanced anti-UVA/UVB filtering system with Mexoryl SX + protecting up to long UVA. • 	Against Pollution Induced Oxidative Stress: A powerful antioxidant complex enriched with Venuceane, an extract from a micro-organism able to survive in extreme environments (high temperature, lack of oxygen, etc.). Key Ingredients: • 	Mexoryl XL Filtering System: La Roche-Posay's special UV filtering system that against UVA, UVB and Long-UVA • 	Carnosine & Vitamin E: A powerful antioxidant complex to help safeguard cells from free-radicals induced by environmental aggressions. • 	La Roche-Posay Thermal Water: Calms and reduces skin irritation. Ingredients: AQUA / WATER •  CI 77891 / TITANIUM DIOXIDE •  ETHYLHEXYL METHOXYCINNAMATE •  GLYCERIN •  DROMETRIZOLE TRISILOXANE •  DIMETHICONE •  ALCOHOL DENAT. •  TITANIUM DIOXIDE •  TEREPHTHALYLIDENE DICAMPHOR SULFONIC ACID •  PROPYLENE GLYCOL •  DIETHYLAMINO HYDROXYBENZOYL HEXYL BENZOATE •  TRIETHANOLAMINE •  CI 77491, CI 77492, CI 77499 / IRON OXIDES •  BIS-ETHYLHEXYLOXYPHENOL METHOXYPHENYL TRIAZINE •  STEARIC ACID •  POTASSIUM CETYL PHOSPHATE •  PENTYLENE GLYCOL •  ALUMINUM HYDROXIDE •  BHT •  BUTYLENE GLYCOL •  BUTYROSPERMUM PARKII SEEDCAKE EXTRACT / SHEA BUTTER SEEDCAKE EXTRACT •  CAPRYLYL GLYCOL •  CARBOMER •  CARNOSINE •  CETYL ALCOHOL •  DISODIUM EDTA •  GLYCERYL STEARATE •  MYRISTIC ACID •  MYRISTYL ALCOHOL •  PALMITIC ACID •  PEG-100 STEARATE •  PHENOXYETHANOL •  SODIUM CHLORIDE •  SODIUM COCOYL SARCOSINATE •  STEARYL ALCOHOL •  TOCOPHEROL •  TROMETHAMINE •  XANTHAN GUM. (C180045/1) Please be aware that ingredient lists for the products of our brand are updated regularly. Please refer to the ingredient list on your product package for the most up to date list of ingredients to ensure it is suitable to your personal use. Size:  30ml Fragrance:  NA KEY FEATURES  • Instantly covers imperfections • Prevents hyperpigmentation • Preventing & corrective care against UVB, UVA, long-UV, and pollution • Light and hydrating, it easily melts into skin • Non oily","Ingredients
884770 1 - INGREDIENTS: AQUA / WATER •  CI 77891 / TITANIUM DIOXIDE •  ETHYLHEXYL METHOXYCINNAMATE •  GLYCERIN •  DROMETRIZOLE TRISILOXANE •  DIMETHICONE •  ALCOHOL DENAT. •  TITANIUM DIOXIDE •  TEREPHTHALYLIDENE DICAMPHOR SULFONIC ACID •  PROPYLENE GLYCOL •  DIETHYLAMINO HYDROXYBENZOYL HEXYL BENZOATE •  TRIETHANOLAMINE •  BIS-ETHYLHEXYLOXYPHENOL METHOXYPHENYL TRIAZINE •  STEARIC ACID •  CI 77491, CI 77492, CI 77499 / IRON OXIDES •  POTASSIUM CETYL PHOSPHATE •  PENTYLENE GLYCOL •  ALUMINUM HYDROXIDE •  BHT •  BUTYLENE GLYCOL •  BUTYROSPERMUM PARKII SEEDCAKE EXTRACT / SHEA BUTTER SEEDCAKE EXTRACT •  CAPRYLYL GLYCOL •  CARBOMER •  CARNOSINE •  CETYL ALCOHOL •  DISODIUM EDTA •  GLYCERYL STEARATE •  MYRISTIC ACID •  MYRISTYL ALCOHOL •  PALMITIC ACID •  PEG-100 STEARATE •  PHENOXYETHANOL •  SODIUM CHLORIDE •  SODIUM COCOYL SARCOSINATE •  STEARYL ALCOHOL •  TOCOPHEROL •  TROMETHAMINE •  XANTHAN GUM (F.I.L. C181256/1).Please be aware that ingredient lists for the products of our brand are updated regularly. Please refer to the ingredient list on your product package for the most up to date list of ingredients to ensure it is suitable to your personal use.",$26.99$11.96 Off RRP!,https://www.chemistwarehouse.com.au/buy/78851/la-roche-posay-uvidea-xl-bb-cream-shade-light-30ml
29,La Roche Posay Hyalu B5 Serum 50ml,"Hyalu B5 Hyaluronic Acid Serum is our first anti-wrinkle solution to intensely hydrate and re-plump ageing skin. The anti-ageing serum has a fresh, hydrating water-gel texture, which is also enriched with vitamin B5, madecassoside and glycerin.  Designed to target wrinkles, loss of volume and elasticity and tired and dull complexion this hyaluronic acid serum is suitable for all skin types but is specifically formulated for those with sensitive skin. Replump and rehydrate skin with hydrating ingredients in a nickel controlled formula. To combine the Hyalu B5 Anti-Ageing Serum with additional hydrating benefits, complete your anti-wrinkle skincare routine with our Hyalu B5 Moisturiser. No1. Dermatologist Recommended Skincare Brand in Australia* *AplusA Healthcare Market Research, Dermatologist barometer survey, Australian dermocosmetic market, January-May 2022. Suitable For:  Suitable for all skin types but is specifically formulated for those with sensitive skin Size:  50mL KEY FEATURES  • 90% say their skin felt: Hydrated, Softer, Suppler* * Results based on a four-week consumer test • Pure hyaluronic acid serum hydrates and visibly plumps skin • Rich serum texture leaves skin feeling supple and hydrated to the touch • Use alone or as an added boost to your favourite moisturiser","Ingredients
609905 19AQUA / WATER •  GLYCERIN •  ALCOHOL DENAT. •  PROPYLENE GLYCOL •  PANTHENOL •  PENTYLENE GLYCOL •  DIMETHICONE •  PEG-6 CAPRYLIC/CAPRIC GLYCERIDES •  PPG-6-DECYLTETRADECETH-30 •  GLYCERYL ISOSTEARATE •  MADECASSOSIDE •  SODIUM HYALURONATE •  AMMONIUM POLYACRYLOYLDIMETHYL TAURATE •  DISODIUM EDTA •  HYDROLYZED HYALURONIC ACID •  CAPRYLYL GLYCOL •  CITRIC ACID •  XANTHAN GUM •  BUTYLENE GLYCOL •  TOCOPHEROL •  PHENOXYETHANOL •  PARFUM / FRAGRANCE	B212343/1Please be aware that ingredient lists for the products of our brand are updated regularly. Please refer to the ingredient list on your product package for the most up to date list of ingredients to ensure it is suitable to your personal use.",$69.99$29.96 Off RRP!,https://www.chemistwarehouse.com.au/buy/124200/la-roche-posay-hyalu-b5-serum-50ml
