,ProductName,ProductDescription,ProductIngredients,ProductPrice,href
0,La Roche-Posay Redermic Vitamin C10 Serum 30ml,"Vitamin C anti-wrinkle serum for sensitive skin  Pure Vitamin C10 Serum 30mL is an anti-ageing serum that reveals sensitive skin's full radiance by targeting skin ageing, and improves skin quality. This Vitamin C and Salicylic Acid serum is an anti-wrinkle solution formulated with Pure Vitamin C (L-ascorbic acid), Salicylic Acid and Neurosensine™ to brighten even sensitive skin types. Designed to tackle wrinkles, loss of radiance, and irregular skin texture that can appear with age, for skin that feels softer, more hydrated, and glowing. PURE VITAMIN C10 Serum has a light, fast-absorbing texture and velvety non-greasy texture, which can be followed with makeup application. Pure Vitamin C ( L-ascorbic acid) is the most biologically active form of the vitamin, and known for key Vitamin C benefits including the improvement of skin radiance and texture with topical application. Instantly, skin feels softer, more hydrated, and glowing. This anti-wrinkle serum formulation targets fine lines for skin that appears smoother. Skin texture and tone appear more uniform, even and refined to regain full radiance with a formula that blends Vitamin C and Salicylic Acid for optimal results. Key Ingredients: PURE VITAMIN C: Within this brightening serum, Vitamin C improves skin radiance and texture. As an anti-wrinkle serum formula, Vitamin C10 works deep within the skin to diminish wrinkles and fine lines for a skin tone and glow that appears improved and restored. SALICYLIC ACID: Salicylic Acid and Vitamin C work together to achieve smoother, more even results. This active ingredient exfoliates surface cells and facilitates in the elimination of dead cells for visibly healthier-looking skin. NEUROSENSINE & THERMAL SPRING WATER Neurosensine is an ingredient naturally found in the skin that works to target skin irritations and provide effective care to areas of discomfort. It works to support the skin barrier function for healthier, more balanced results Ingredients: Aqua /Water •  Ascorbic Ac Id •  Cyclohexas I Loxane •  Glyce R In •  Alcohol Denat. •  Potassium Hydroxi De •  Polymethylsilsesquioxane •  Polysilicone-11 •  Dimethicone •  Propylene Glycol •  Pentaerythrityl Tetraethylhexanoate •  C13-14 Isoparaffin •  Peg-20 Methyl Glucose Sesquistearate •  Sodium Hyaluronate •  Adenosine •  Poloxamer 338 •  Ammonium Polyacryloyldimethyl Taurate •  Disodium Edta •  Hydrolyzed Hyaluronic Acid •  Caprylyl Glycol •  Laureth-7 •  Acetyl Dipeptide-1 Cetyl Ester •  Xanthan Gum • Toluene Sulfonicacid •  Polyacrylamide •  Tocopherol •  Salicylic Acid •  Parfum / Fragrance. (B224008/0) Please be aware that ingredient lists for the products of our brand are updated regularly. Please refer to the ingredient list on your product package for the most up to date list of ingredients to ensure it is suitable to your personal use. Size:  30ml Fragrance:  NA KEY FEATURES  • Improves skin radiance and texture • Instantly, skin feels softer, more hydrated, and glowing • Targets fine lines for skin and appears smoother • Skin texture and tone appear more uniform, even and refined to regain full radiance • Wrinkles reduced","Ingredients
Please be aware that ingredient lists for the products of our brand are updated regularly. Please refer to the ingredient list on your product package for the most up to date list of ingredients to ensure it is suitable to your personal use.",$49.99$21.96 Off RRP!,https://www.chemistwarehouse.com.au/buy/92046/la-roche-posay-redermic-vitamin-c10-serum-30ml
1,La Roche-Posay Lipikar Baume AP+M Body Balm 400ml,"Body moisturiser for mild eczema-prone skin or dry skin  Lipikar AP+M Triple-Action Balm is a lipid-replenishing body cream that is formulated to reduce dryness, restore hydration and comfort to dry or very dry skin. Suitable for use on mild eczema-prone skin. The formulation is designed to reduce dryness and soothe skin. It is enriched with prebiotic Aqua Posae Filiformis and Microresyl to help rebalance the skin's Microbiome, as well as Shea Butter and Niacinamide to replenish the skins protective barrier. Dermatologically tested for sensitive skin, Lipikar AP+M Triple-Action Body Balm is a minimalist, non-greasy and non-sticky formulation that is fragrance-free. Ideal for sensitive, very dry skin and suitable for adults, newborns, babies and children. To help reduce dryness from the shower, we recommend cleansing with a gentle lipid-replenishing soap-free product, such as Lipikar Syndet AP+ Wash Cream. Follow cleansing with an application of Lipikar AP+M Body Balm. Tested on more than 700 subjects with dermatologists and paediatricians. Fragrance-free. If you suffer from eczema, we recommend you consult with your doctor or other qualified healthcare professional. Lipikar AP+M Triple-Action Body Balm has a minimalist, fragrance free formula that quickly absorbs to facilitate and speed up daily application. Its nourishing texture is non-greasy and non-sticky and is suitable for use morning and night. Key Ingredients: - NIACINAMIDE: A soothing active ingredient that helps to soothe itching sensations and restore lipid barrier on skin. Suitable for atopic eczema-prone skin. - SHEA BUTTER: A key ingredient in all of the Lipikar formulas, Shea Butter is renowned for its ability to restore the skin's hydrolipidic film with lipids similar to skin's own. - AP+M TECHNOLOGY [AQUA POSAE + MICRORESYL]: An exclusive active complex to rebalance skin microbiome - skin's invisible living ecosystem. Ingredients: Aqua / Water •  Butyrospermum Parkii Butter / Shea Butter •  Glycerin •  Dimethicone •  Niacinamide •  Cetearyl Alcohol •  Brassica Campestris Seed Oil / Rapeseed Seed Oil •  Glyceryl Stearate •  Ammonium Polyacryloyldimethyl Taurate •  Peg-100 Stearate •  Propanediol •  Ophiopogon Japonicus Root Extract •  Peg-20 Methyl Glucose Sesquistearate •  Sorbitan Tristearate •  Dimethiconol •  Sodium Chloride •  Mannose •  Coco-Betaine •  Disodium Edta •  Capryloyl Glycine •  Caprylyl Glycol •  Vitreoscilla Ferment •  Citric Acid •  Maltodextrin •  Xanthan Gum •  Tocopherol •  Pentaerythrityl Tetra-Di-T-Butyl Hydroxyhydrocinnamate (B237057/1) Please be aware that ingredient lists for the products of our brand are updated regularly. Please refer to the ingredient list on your product package for the most up to date list of ingredients to ensure it is suitable to your personal use. Size:  400ml Fragrance:  NA KEY FEATURES  • Formulated to reduce dryness, restore hydration and comfort to dry or very dry skin • Suitable for newborns, babies, children and adults • Suitable for use on both the face and body • Dermatologically tested for sensitive skin • Minimalist, non-greasy and non-sticky formulation","Ingredients
609959 42 - INGREDIENTS: AQUA / WATER •  BUTYROSPERMUM PARKII BUTTER / SHEA BUTTER •  GLYCERIN •  DIMETHICONE •  NIACINAMIDE •  CETEARYL ALCOHOL •  BRASSICA CAMPESTRIS SEED OIL / RAPESEED SEED OIL •  GLYCERYL STEARATE •  AMMONIUM POLYACRYLOYLDIMETHYL TAURATE •  PEG-100 STEARATE •  PROPANEDIOL •  OPHIOPOGON JAPONICUS ROOT EXTRACT •  PEG-20 METHYL GLUCOSE SESQUISTEARATE •  SORBITAN TRISTEARATE •  DIMETHICONOL •  SODIUM CHLORIDE •  MANNOSE •  COCO-BETAINE •  DISODIUM EDTA •  CAPRYLOYL GLYCINE •  CAPRYLYL GLYCOL •  VITREOSCILLA FERMENT •  CITRIC ACID •  MALTODEXTRIN •  XANTHAN GUM •  TOCOPHEROL •  PENTAERYTHRITYL TETRA-DI-T-BUTYL HYDROXYHYDROCINNAMATE (F.I.L. B237057/1).Please be aware that ingredient lists for the products of our brand are updated regularly. Please refer to the ingredient list on your product package for the most up to date list of ingredients to ensure it is suitable to your personal use.",$29.99$12.96 Off RRP!,https://www.chemistwarehouse.com.au/buy/78825/la-roche-posay-lipikar-baume-ap-m-body-balm-400ml
2,La Roche Posay Effaclar Foaming Gel 400ml,"Effaclar Foaming Gel is a daily use gel cleanser that removes makeup, eliminates impurities and excess sebum.  Suitable for sensitive, oily and acne-prone skin. EFFACLAR FOAMING GEL gently purifies the skin thanks to cleansing agents selected to respect sensitive skin. It eliminates impurities and excess sebum while leaving the skin clean and fresh. With soothing, anti-irritant La Roche-Posay Thermal Spring Water. Gentle formula that is pH 5.5 and non-comedogenic and is soap, alcohol and colourant free Suitable For:  Sensitive Skin Size:  400mL Hypo Allergenic?:  Yes KEY FEATURES  • Help reduce impurities and excess sebum • Soap-free • Suitable for sensitive, oily and acne-prone skin • Suitable for sensitive, oily and acne-prone skin • Ultra-safe formula that is non-comedogenic","Ingredients
Ingredients: Aqua / Water, Sodium Laureth Sulfate, Peg-8, Coco-Betaine, Hexylene Glycol, Sodium Chloride, Peg-120 Methyl Glucose Dioleate, Zinc Pca, Sodium Hydroxide, Citric Acid, Sodium Benzoate, Phenoxyethanol, Caprylyl Glycol, Parfum / Fragrance, (Fil Code: B32025/1)Please be aware that ingredient lists for the products of our brand are updated regularly. Please refer to the ingredient list on your product package for the most up to date list of ingredients to ensure it is suitable to your personal use.",$24.99$10.96 Off RRP!,https://www.chemistwarehouse.com.au/buy/86703/la-roche-posay-effaclar-foaming-gel-400ml
3,La Roche Posay Anthelios Invisible Fluid SPF 50+ 50ml,"Lightweight face sunscreen for sensitive skin  Anthelios Invisible Fluid Facial Sunscreen SPF 50+ 50mL is a lightweight daily facial sunscreen made for sensitive skin, providing very high UVA/UVB protection while delivering an invisible finish. This fragrance-free, organic filter (also known as chemical) facial sunscreen is suitable for normal to combination skin, and also specifically designed for sensitive skin types. The invisible fluid sunscreen formula is non-greasy and non-comedogenic, meaning it protects your skin without clogging pores. It is non eye-stinging. UV radiation is present every day of the year. Ensure your skin is protected from the damaging UV rays by integrating in your skincare routine a daily SPF 50+ sunscreen that blocks both UVA and UVB rays. If you have oily skin, we recommend the Anthelios XL Anti-Shine Dry Touch Facial Sunscreen SPF 50+ for a matte, lightweight finish. If you have dry skin, we recommend the Anthelios Ultra Facial Sunscreen SPF 50+ for a nourishing, lightweight finish. Featuring a lightweight, virtually invisible fluid that absorbs easily and is non-greasy and non-comedogenic, which means it won't clog pores or be visible under makeup. KEY INGREDIENTS INTELLIGENT POLYMERS - For Even Coverage, A Non-Greasy Finish And High Resistance: A breakthrough ingredient in sun care. The polymers lock the oil within the formula in between micro-crystals, and make the formula non-greasy. XL-PROTECT - Broad-Spectrum Protection Filter: A powerful blend of UV filters and anti-oxidants that goes above broad-spectrum UVA and UVB protection to shield against damage from other skin aggressors, such as infrared and pollution. GLYCERIN - For Hydrated, Comfortable Skin: Glycerin helps to hydrate and moisturise the skin after initial application. Ingredients: Aqua/Water, Alcohol Denat., Diisopropyl Sebacate, Silica, Isopropyl Myristate, Ethylhexyl Salicylate, Ethylhexyl Triazone, Bis-Ethylhexyloxyphenol Methoxphenyl Triazine, Butyl Methoxydibenzoylmethane, Glycerin, C12-22 Alkyl Acrylate/Hydroxyethylacrylate Copolymer, Propanediol, Drometrizole Trisiloxane, Perlite, Tocopherol, Caprylic/Capric Triglyceride, Acrylates/C10-30 Alkyl Acrylate Crosspolymer, Caprylyl Glycol, Hydroxyethylcellulose, Terephthalylidene Dicamphor Sulfonic Acid, Triethanolamine, Trisodium Ethylenediamine Disucciante (C227022/1) Please be aware that ingredient lists for the products of our brand are updated regularly. Please refer to the ingredient list on your product package for the most up to date list of ingredients to ensure it is suitable to your personal use. Size:  50ml Fragrance:  NA KEY FEATURES  • Lightweight formula is comfortable for daily wear • Very High UVA/UVB protection • Fragrance free formula • Formulated for sensitive skin • Invisible finish, that is easy to seamlessly apply makeup over","Ingredients
885023 47 - INGREDIENTS: AQUA / WATER •  ALCOHOL DENAT. •  DIISOPROPYL SEBACATE •  SILICA •  ISOPROPYL MYRISTATE •  ETHYLHEXYL SALICYLATE •  ETHYLHEXYL TRIAZONE •  BIS-ETHYLHEXYLOXYPHENOL METHOXYPHENYL TRIAZINE •  BUTYL METHOXYDIBENZOYLMETHANE •  GLYCERIN •  C12-22 ALKYL ACRYLATE/HYDROXYETHYLACRYLATE COPOLYMER •  PROPANEDIOL •  DROMETRIZOLE TRISILOXANE •  PERLITE •  TOCOPHEROL •  CAPRYLIC/CAPRIC TRIGLYCERIDE •  ACRYLATES/C10-30 ALKYL ACRYLATE CROSSPOLYMER •  CAPRYLYL GLYCOL •  HYDROXYETHYLCELLULOSE •  TEREPHTHALYLIDENE DICAMPHOR SULFONIC ACID •  TRIETHANOLAMINE •  TRISODIUM ETHYLENEDIAMINE DISUCCINATE (F.I.L. C227022/1).Please be aware that ingredient lists for the products of our brand are updated regularly. Please refer to the ingredient list on your product package for the most up to date list of ingredients to ensure it is suitable to your personal use.",$24.99$10.96 Off RRP!,https://www.chemistwarehouse.com.au/buy/101139/la-roche-posay-anthelios-invisible-fluid-spf-50-50ml
4,La Roche Posay Niacinamide 10 Serum 30ml,"Hydrating niacinamide serum with Hyaluronic Acid and Niacinamide for a more even skin tone and anti-dark spots.  La Roche Posay's first Pure 10% Niacinamide serum is a multi-tasking dermatological serum developed to suit all skin types including sensitive skin. This serum with Niacinamide, and Hyaluronic Acid helps to even out skin tone, hydrate and brighten, whilst improving the appearance of dark spots. The Pure Niacinamide 10 Serum for dark spots is specifically formulated for sensitive skin types. The powerful dermatologically tested formula contains 10% Niacinamide (hydrate & smooth), and 5% HEPES (gently exfoliates). This serum for a more even skin tone with Niacinamide also helps with skin texture, making skin look brighter and smoother while the Hyaluronic Acid helps to lock-in moisture leaving skin looking plump and healthy. The La Roche-Posay Pure Niacinamide 10 serum for dark spots and even skin tone is light and non-sticky, to feel and fast absorbing. Follow the application of the Niacinamide serum with a face moisturiser suitable for sensitive skin such as the Toleriane Dermallergo Fluid Lightweight Moisturiser. KEY INGREDIENTS: A powerful dermatologically tested formula that contains 10% Niacinamide (hydrate & smooth), and 5% HEPES (gently exfoliates). The serum with Hyaluronic Acid helps to retain the skin's natural moisture. NIACINAMIDE Niacinamide has multiple benefits as a skincare ingredient, some of the main features being anti-redness, anti-acne and supports cell regeneration helping with improved skin texture and skin tone. Niacinamide also helps with the appearance of dark spots and supporting the skin moisture barrier. HYALURONIC ACID Hyaluronic Acid is known to be a humectant, which means that it not only retains moisture within in the skin but also absorbs moisture from its surroundings. Hyaluronic Acid can hold up to 1000x its weight in moisture making it an ideal ingredient for skin hydration. GLYCERIN Glycerin, also known as Glycerol, is a natural compound obtained from vegetable oils and animal fats. Glycerin is a humectant, which means that it attracts moisture from its surroundings and lock in that moisture into your skin. Glycerin also helps to support skin barrier function and maintain skin health. Size:  30ml Fragrance:  NA KEY FEATURES  • Formulated for all skin types, specifically sensitive skin, to hydrate the skin and reduce the appearance of dark spots. • Helps even out dull skin tone by brightening the overall appearance of the face and supporting the skin against signs of sun damage. • Light and non-sticky, to feel and fast absorbing. • Helps to retain the skin's natural moisture.","Ingredients
2039057 27 - INGREDIENTS: AQUA / WATER / EAU •  NIACINAMIDE •  GLYCERIN •  ALCOHOL DENAT. •  HYDROXYETHYLPIPERAZINE ETHANE SULFONIC ACID •  DIMETHICONE •  ISOPROPYL LAUROYL SARCOSINATE •  OCTYLDODECANOL •  PEG-20 METHYL GLUCOSE SESQUISTEARATE •  TIN OXIDE •  SORBITAN OLEATE •  DIMETHICONOL •  CETEARYL ETHYLHEXANOATE •  ISOHEXADECANE •  SODIUM HYALURONATE •  PHENYLETHYL RESORCINOL •  POLOXAMER 338 •  AMMONIUM POLYACRYLOYLDIMETHYL TAURATE •  DISODIUM EDTA •  ISOPROPYL MYRISTATE •  CITRIC ACID •  XANTHAN GUM •  POLYSORBATE 80 •  ACRYLAMIDE/SODIUM ACRYLOYLDIMETHYLTAURATE COPOLYMER •  TOCOPHEROL •  PHENOXYETHANOL •  MICA •  CI 77891 / TITANIUM DIOXIDE •  PARFUM / FRAGRANCE (F.I.L. N292380/1).Please be aware that ingredient lists for the products of our brand are updated regularly. Please refer to the ingredient list on your product package for the most up to date list of ingredients to ensure it is suitable to your personal use.",$49.99$21.96 Off RRP!,https://www.chemistwarehouse.com.au/buy/117912/la-roche-posay-niacinamide-10-serum-30ml
5,La Roche Posay Cicaplast Baume B5+ 100ml,"CICAPLAST Baume B5+ is a multi-purpose balm which hydrates and soothes dry skin. It is suitable for the whole family.Powered by the exclusive prebiotic Tribioma.It is also enriched with Madecassoside - a repairing active ingredient - soothing Panthenol, and anti-bacterial agents. It soothes, nourishes, and protects your dry skin to aid in moisture barrier repair function.*Skin Moisture Barrier Repair, instrumental test, 26 subjects vs untreated skin Size:  100ml KEY FEATURES  • Optimal skin barrier support: [Madecassoside] + [Copper - Zinc - Manganese] + [Tribioma] • Hydration and Soothing of dry areas: [5% Panthenol] • Supports microbiome function: [Tribioma] + [Rich, nourishing texture] • CLAIMS Babies- 90% agree skin seems protected*- 100% agree skin seems regenerated* Adults- 90% agree skin seems protected**- 90% agree Skin seems less damaged***Protocol: 2x/day, 4 weeks - under paediatric and dermatological control - 52 babies (from 4 to 34 months old)**Use 2x/day for 7 days on the areas treated by laser, 42 subjects, 18-68 years old, all skin types","Ingredients
Key Ingredients: Vitamin B5 (Panthenol): Panthenol, also known as Vitamin B5, is an active ingredient renowned for its skin-soothing and skin barrier benefits. Vitamin B5 for skin makes an ideal addition to a cream for dry skin due to its ultra-nourishing properies.Madecassoside: As a remarkable extract of the herb Centella Asiatica, madecassoside is a soothing agent that supports natural skin renewal. Madecassoside is suitable for sensitive skin and has demonstrated efficacy on repairing skin dryness.2039030 58 - INGREDIENTS : AQUA / WATER / EAU •  HYDROGENATEDPOLYISOBUTENE •  DIMETHICONE •  GLYCERIN •  BUTYROSPERMUMPARKII BUTTER / SHEA BUTTER •  PANTHENOL •  ZEA MAYS STARCH /CORN STARCH •  PROPANEDIOL •  BUTYLENE GLYCOL •  CETYLPEG/PPG-10/1 DIMETHICONE •  TRIHYDROXYSTEARIN •  CENTELLAASIATICA LEAF EXTRACT •  POLYMNIA SONCHIFOLIA ROOT JUICE •  ZINCGLUCONATE •  MADECASSOSIDE •  MANGANESE GLUCONATE • ALPHA-GLUCAN OLIGOSACCHARIDE •  SILICA •  ALUMINUM HYDROXIDE•  MAGNESIUM SULFATE •  MANNOSE •  CAPRYLOYL GLYCINE • CAPRYLYL GLYCOL •  VITREOSCILLA FERMENT •  CITRIC ACID • TRISODIUM ETHYLENEDIAMINE DISUCCINATE •  LACTOBACILLUS • ACETYLATED GLYCOL STEARATE • MALTODEXTRIN •  POLYGLYCERYL-4ISOSTEARATE •  TOCOPHEROL •  PENTAERYTHRITYL TETRA-DI-T-BUTYLHYDROXYHYDROCINNAMATE •  CI 77891 / TITANIUM DIOXIDE.(CODE F.I.L. : N70011474/1)Please be aware that ingredient lists for the products of our brand are updated regularly. Please refer to the ingredient list on your product package for the most up to date list of ingredients to ensure it is suitable to your personal use.",$28.39$12.16 Off RRP!,https://www.chemistwarehouse.com.au/buy/122042/la-roche-posay-cicaplast-baume-b5-100ml
6,La Roche-Posay Hyalu B5 Hyaluronic Acid Anti-Ageing Serum 30ml,"Vitamin B5 & Hyaluronic Acid anti-ageing serum for sensitive skin  Hyalu B5 Hyaluronic Acid Serum 30mL is our first anti-wrinkle solution to intensely hydrate and re-plump ageing skin. The anti-ageing serum has a fresh, hydrating water-gel texture, which is also enriched with Vitamin B5, Madecassoside and Glycerin. Designed to target wrinkles, loss of volume and elasticity and tired and dull complexion, this Hyaluronic Acid serum is suitable for all skin types but is specifically formulated for those with sensitive skin. Replump and rehydrate skin with hydrating ingredients in a nickel-controlled formula. To combine the Hyalu B5 Anti-Ageing Serum with additional hydrating benefits, complete your anti-wrinkle skincare routine with our Hyalu B5 Moisturiser. Smooth, fresh, and melting texture with a hydrating water-gel formula, and infused with La Roche-Posay Thermal Spring Water. Key Ingredients: HYALURONIC ACID: Hyaluronic acid for skin is the go-to anti-ageing molecule used by dermatologists in aesthetic procedures to address wrinkles and reduce skin plumpness. La Roche Posay uses fragmented & high molecular weight to re-plump the skin for healthy, hydrated results. VITAMIN B5: Vitamin B5 is renowned for its soothing and smoothing properties. It stimulates the skin's regeneration and resistance for healthier, more balanced results. B5 maintains hydration in the skin by absorbing moisture in the air. GLYCERIN: Glycerin is a humectant that works to increase skin hydration to prevent dryness for a visibly healthier appearance. It works by drawing moisture to the surface of the skin for a healthy, youthful glow, making it the ideal addition to anti-ageing serum. Ingredients: AQUA / WATER •  GLYCERIN •  ALCOHOL DENAT •  PROPYLENE GLYCOL •  PANTHENOL •  PENTYLENE GLYCOL •  DIMETHICONE •  PEG-6 CAPRYLIC/CAPRIC GLYCERIDES •  PPG-6-DECYLTETRADECETH-30 •  GLYCERYL ISOSTEARATE •  MADECASSOSIDE •  SODIUM HYALURONATE •  AMMONIUM POLYACRYLOYLDIMETHYL TAURATE •  DISODIUM EDTA •  HYDROLYZED HYALURONIC ACID •  CAPRYLYL GLYCOL •  CITRIC ACID •  XANTHAN GUM •  BUTYLENE GLYCOL •  TOCOPHEROL •  PHENOXYETHANOL •  PARFUM /FRAGRANCE (B212343/1) Please be aware that ingredient lists for the products of our brand are updated regularly. Please refer to the ingredient list on your product package for the most up to date list of ingredients to ensure it is suitable to your personal use. Size:  30ml Fragrance:  NA KEY FEATURES  • A unique hydrating, re-plumping formula enriched with two pure hyaluronic acids and vitamin B5 • Re-plump skin and repairs skin's barrier • Reduces wrinkles • Re-plumps the skin • Increases skin volume and elasticity","Ingredients
609905 19 - INGREDIENTS: AQUA / WATER •  GLYCERIN •  ALCOHOL DENAT. •  PROPYLENE GLYCOL •  PANTHENOL •  PENTYLENE GLYCOL •  DIMETHICONE •  PEG-6 CAPRYLIC/CAPRIC GLYCERIDES •  PPG-6-DECYLTETRADECETH-30 •  GLYCERYL ISOSTEARATE •  MADECASSOSIDE •  SODIUM HYALURONATE •  AMMONIUM POLYACRYLOYLDIMETHYL TAURATE •  DISODIUM EDTA •  HYDROLYZED HYALURONIC ACID •  CAPRYLYL GLYCOL •  CITRIC ACID •  XANTHAN GUM •  BUTYLENE GLYCOL •  TOCOPHEROL •  PHENOXYETHANOL •  PARFUM / FRAGRANCE (F.I.L. B212343/1).Please be aware that ingredient lists for the products of our brand are updated regularly. Please refer to the ingredient list on your product package for the most up to date list of ingredients to ensure it is suitable to your personal use.",$49.99$21.96 Off RRP!,https://www.chemistwarehouse.com.au/buy/87357/la-roche-posay-hyalu-b5-hyaluronic-acid-anti-ageing-serum-30ml
