,ProductName,ProductDescription,ProductIngredients,ProductPrice,href
30,La Roche Posay Effaclar Micro Peeling Purifying Gel 400ml,"Effaclar Micro-Peeling Purifying Gel Cleanser 400ml is the ultimate cleanser for acne-prone skin. This gel cleanser works to not only deeply exfoliate and help to reduce excess sebum but to also target pimples and visibly reduce breakout recurrence.  Suitable for use as cleanser for face and body, Effaclar Micro-Peeling Purifying Gel Cleanser Cleanser targets pimples on the face, chest and back while also helping to reduce marks.The scientifically proven formula with LHA and Salicylic Acid micro-exfoliates and purifies the skin helping to eliminate dead skin cells, deeply unclogs pores and reduces excess sebum visibly reducing the appearance of blackheads and pimples. Leaving skin soft, clean and refreshed, while bringing maximum comfort to acne-prone skin, even on the body. Suitable For:  Suitable for use as cleanser for face and body. Suitable for acne-prone skin. Product Claims:  Effaclar Micro-Peeling Purifying Gel Cleanser is the ultimate cleanser for acne-prone skin. Scientifically proven for face, chest and back acne. Size:  400mL Skin Type:  Oily KEY FEATURES  • 51% reduction of blemishes in just 4 weeks* *N=52, 4 week study, applying 1x /day on face, counting lesions by the dermatologist. • Scientifically proven for face, chest and back acne. • 54% reduction of body blemishes in just 84 days^ ^N=35, results after 42 and 84 days of treatment, counting lesions by the dermatologist • Anti-recurrence efficacy • Helps irregular skin textures","Ingredients
609715 05AQUA / WATER •  SODIUM LAURETH SULFATE •  DECIL GLUCOSIDE •  GLYCERIN •  SODIUM CHLORIDE •  COCO-BETANE. SALICYLIC ACID •  PEG- 150 PENTAERYTHRITYL TETRASTEARATE •  PEG-6 CAPRYLIC/CAPRIC GLYCERIDES •  ZINC GLUCONATE •  SODIUM HYDROXIDE •  CAPRYLOYL SALICYLIC ACID •  TETRASODIUM EDTA •  CITRIC ACID•  MENTHOL •  POLYQUATERNIUM-47 •  HEXYLENE GLYCOL •  SODIUM BENZOATEB243870/1Please be aware that ingredient lists for the products of our brand are updated regularly. Please refer to the ingredient list on your product package for the most up to date list of ingredients to ensure it is suitable to your personal use.",$27.99$11.96 Off RRP!,https://www.chemistwarehouse.com.au/buy/124199/la-roche-posay-effaclar-micro-peeling-purifying-gel-400ml
31,La Roche-Posay Toleriane Sensitive Riche Facial Moisturiser 40ml,"Moisturiser for face suitable to dry, intolerant skin  Toleriane Sensitive Riche Facial Cream 40mL is a soothing protective cream - a hydrating prebiotic moisturiser for sensitive skin, dry skin prone to irritation. It helps to hydrate, protect and soothe skin. It is suitable even for children & babies delicate skin. Enriched with La Roche-Posay Thermal Spring Water, Toleriane Sensitive Riche facial moisturiser features an extra-hydrating, rich texture for sensitive skin. For sensitive and intolerant skin, Toleriane Sensitive Creme is a minimal formula to protect the skin like Toleriane Riche, but with a lighter texture. Key Ingredients - SHEA BUTTER: Repairs and protects the skin barrier. - LA ROCHE-POSAY THERMAL WATER: Calms skin. Reduces redness and irritation. - GLYCERIN: Provides intense 48-hour hydration. Ingredients: AQUA / WATER •  ISOCETYL STEARATE •  COCO-CAPRYLATE/CAPRATE •  SQUALANE •  BUTYROSPERMUM PARKII BUTTER / SHEA BUTTER •  GLYCERIN •  PROPANEDIOL •  CETYL ALCOHOL •  ALUMINUM STARCH OCTENYLSUCCINATE •  GLYCERYL STEARATE •  PENTYLENE GLYCOL •  PEG-100 STEARATE •  NIACINAMIDE •  CETEARYL ALCOHOL •  SODIUM HYDROXIDE •  CAPRYLYL GLYCOL •  CITRIC ACID •  ACRYLATES/C10-30 ALKYL ACRYLATE CROSSPOLYMER (B5144/7) Please be aware that ingredient lists for the products of our brand are updated regularly. Please refer to the ingredient list on your product package for the most up to date list of ingredients to ensure it is suitable to your personal use. Size:  40ml Fragrance:  NA KEY FEATURES  • When the skin is sensitive it is necessary to help preserve its microbiome; the invisible barrier that naturally protects the skin. This is the role of prebiotics in skincare. • Soothing and protective actives including Glycerin, that hydrates for 48hrs and Vitamin B3 to comfort sensitive skin • Helps relieve dryness, and occasional redness. • Intense soothing • Hydrating","Ingredients
609913 20 - INGREDIENTS: AQUA •  ISOCETYL STEARATE •  COCO-CAPRYLATE/CAPRATE •  SQUALANE •  BUTYROSPERMUM PARKII BUTTER •  GLYCERIN •  PROPANEDIOL •  CETYL ALCOHOL •  ALUMINUM STARCH OCTENYLSUCCINATE •  GLYCERYL STEARATE •  PENTYLENE GLYCOL •  PEG-100 STEARATE •  NIACINAMIDE •  SODIUM HYDROXIDE •  CAPRYLYL GLYCOL •  ACRYLATES/C10-30 ALKYL ACRYLATE CROSSPOLYMER •  CETEARYL ALCOHOL •  CITRIC ACID (F.I.L. C229147/1).Please be aware that ingredient lists for the products of our brand are updated regularly. Please refer to the ingredient list on your product package for the most up to date list of ingredients to ensure it is suitable to your personal use.",$23.69$10.26 Off RRP!,https://www.chemistwarehouse.com.au/buy/78844/la-roche-posay-toleriane-sensitive-riche-facial-moisturiser-40ml
32,La Roche-Posay Lipikar Cleansing Oil 400ml,"La Roche-Posay® Lipikar Huile Lavante Cleansing Oil is formulated for dry to very dry sensitive skin. It contains prebiotics to help rebalance the skins microbiome. It also protects the skin against the drying effects of hard water.  Its ultra-gentle formula is enriched with soothing Niacinamide and lipid-replenishing Shea Butter. Also enriched with prebiotic Aqua Posae Filiformis to help rebalance the microbiome. Does not sting the eyes. Suitable for use on babies, children and adults. Suitable For:  Sensitive Skin Recommended By:  Dermatologists Size:  400ml KEY FEATURES  • Gently cleanses & nourishes the skin • Long-lasting comfort of dry skin • Bathing becomes a please again • Anti-friction foaming texture. Hypoallergenic perfume. Easy rinse-off.","Ingredients
800452 15 - Ingredients: Aqua / Water, Sorbitol, Sodium Laureth Sulfate, Peg-60 Hydrogenated Castor Oil, Peg-7 Glyceryl Cocoate, Cocamide Mea, Coco-Betaine, Ceteareth-60 Myristyl Glycol, Citric Acid, Hydroxypropyl Guar Hydroxypropyltrimonium Chloride, Niacinamide, Parfum / Fragrance, Peg-55 Propylene Glycol Oleate, Peg-75 Shea Butter Glycerides, Ppg-5-Ceteth-20, Propylene Glycol, Sodium Benzoate, Sodium Chloride, Sodium Hydroxide. (CODE F.I.L C41700/1)Please be aware that ingredient lists for the products of our brand are updated regularly. Please refer to the ingredient list on your product package for the most up to date list of ingredients to ensure it is suitable to your personal use.",$26.39$11.56 Off RRP!,https://www.chemistwarehouse.com.au/buy/78828/la-roche-posay-lipikar-cleansing-oil-400ml
33,La Roche Posay Toleriane Dermallergo Night 40ml,Toleriane Dermallergo Overnight Sensitive Moisturiser is a night moisturiser for sensitive or easily irritated skin. The intense dermatological moisturiser soothes the feeling of dryness and irritation upon waking. Tested on allergy prone skin.      Size:  40mL,Error while retreiving html,$31.39$13.56 Off RRP!,https://www.chemistwarehouse.com.au/buy/119046/la-roche-posay-toleriane-dermallergo-night-40ml
34,La Roche-Posay Hyalu B5 Hyaluronic Acid Anti-Ageing Moisturiser 40ml,"Anti-ageing Hyaluronic Acid moisturiser  Hyalu B5 Hyaluronic Acid Anti-Ageing Moisturiser 40mL is clinically proven to hydrate and re-plump skin. Deeply hydrated, skin immediately regains its bounce, and wrinkles look smoothed and reduced. Suitable for all skin types, Hyalu B5 Hyaluronic Acid Anti-Ageing Moisturiser is specifically designed for sensitive skin to target wrinkles, loss of volume and skin elasticity. A unique hydrating, re-plumping, nickel-controlled formula with two pure Hyaluronic Acids and Vitamin B5 to plump and hydrate skin, on the surface and within. Smooth, fresh texture in a re-plumping hydrating cream. Easily absorbed and formulated with La Roche-Posay Thermal Spring Water. For a complete skin replumping routine, use the Hyalu B5 Hyaluronic Acid Anti-Ageing Moisturiser after the Hyalu B5 Anti-Ageing Serum, the 1st dermatological anti-wrinkle solution. Key Ingredients: DUO OF HYALURONIC ACIDS: Hyaluronic Acid is the go-to anti-ageing molecule used by dermatologists in aesthetic procedures to address wrinkles and reduced skin plumpness. La Roche-Posay uses fragmented & high molecular weight Hyaluronic Acid to re-plump the skin. VITAMIN B5: Vitamin B5 is renowned for its soothing and repairing benefits. It stimulates the skin's regeneration and resistance. LA ROCHE-POSAY THERMAL SPRING WATER: Soothing and softening, moisturising. Ingredients: AQUA •  GLYCERIN •  DIMETHICONE •  HYDROGENATED POLYISOBUTENE •  PROPYLENE GLYCOL •  HYDROXYPROPYL TETRAHYDROPYRANTRIOL •  ALCOHOL DENAT •  PROPANEDIOL •  PANTHENOL •  SYNTHETIC WAX •  NYLON-12 •  PEG-10 DIMETHICONE •  DIMETHICONE/PEG-10/15 CROSSPOLYMER •  HYDROXYETHYLPIPERAZINE ETHANE SULFONIC ACID •  TOCOPHEROL •  SODIUM POLYACRYLATE •  SODIUM HYALURONATE •  HYDROLYZED HYALURONIC ACID •  SODIUM CITRATE •  PHENOXYETHANOL •  ADENOSINE •  CHLORPHENESIN •  PROPYLENE CARBONATE •  DIPROPYLENE GLYCOL •  DISTEARDIMONIUM HECTORITE •  DISODIUM EDTA •  PARFUM (C213954/1). Please be aware that ingredient lists for the products of our brand are updated regularly. Please refer to the ingredient list on your product package for the most up to date list of ingredients to ensure it is suitable to your personal use. Size:  40ml Fragrance:  NA KEY FEATURES  • A unique hydrating, re-plumping formula enriched with two pure hyaluronic acids and vitamin B5 • Re-plump skin and repairs skin's barrier • Reduces wrinkles • Increases skin volume and elasticity • Improves skin's repairing process","Ingredients
609907 06 - INGREDIENTS: AQUA / WATER / EAU •  GLYCERIN •  DIMETHICONE •  HYDROGENATED POLYISOBUTENE •  PROPYLENE GLYCOL •  HYDROXYPROPYL TETRAHYDROPYRANTRIOL •  ALCOHOL DENAT. •  PROPANEDIOL •  PANTHENOL •  SYNTHETIC WAX •  NYLON-12 •  PEG-10 DIMETHICONE •  DIMETHICONE/PEG-10/15 CROSSPOLYMER •  HYDROXYETHYLPIPERAZINE ETHANE SULFONIC ACID •  SODIUM CITRATE •  SODIUM HYALURONATE •  SODIUM POLYACRYLATE •  ADENOSINE •  DISODIUM EDTA •  PROPYLENE CARBONATE •  HYDROLYZED HYALURONIC ACID •  DIPROPYLENE GLYCOL •  DISTEARDIMONIUM HECTORITE •  TOCOPHEROL •  PHENOXYETHANOL •  CHLORPHENESIN •  PARFUM / FRAGRANCE (F.I.L. B265740/1).Please be aware that ingredient lists for the products of our brand are updated regularly. Please refer to the ingredient list on your product package for the most up to date list of ingredients to ensure it is suitable to your personal use.",$45.39$19.56 Off RRP!,https://www.chemistwarehouse.com.au/buy/87356/la-roche-posay-hyalu-b5-hyaluronic-acid-anti-ageing-moisturiser-40ml
35,La Roche-Posay Effaclar Anti-Acne Starter Kit,"Cleanser & moisturiser skincare set for oily, acne-prone skin.  The Effaclar range is a daily use regime for sensitive, oily, acne-prone skin. The Effaclar Anti-Acne Starter Kit provides you with your Effaclar daily routine with up to a two-week supply, great for trial or travel. Contains Effaclar Purifying Foaming Gel 50ml and Effaclar Duo (+) 15ml. Effaclar Purifying Foaming Gel is a foaming cleanser specially formulated for sensitive, oily, acne-prone skin. This gentle and effective acne face wash eliminates impurities, excess sebum and lifts away dirt. The Effaclar Purifying Foaming Gel cleanser respects the skin's PH balance. The gentle formula has a pH 5.5, the average PH value of the skin's surface, so there is no disruption to the skin's natural balance. Effaclar Duo (+) is a corrective moisturiser that hydrates the skin and targets blemishes, imperfections and marks. Effaclar Duo (+) is a dual-action pimple cream that targets acne prone & congested skin. This acne cream exfoliates dead skin and excess sebum, reduces redness, spots and breakouts, stimulates cell renewal and targets skin imperfections. KEY INGREDIENTS: - NIACINAMIDE: Active ingredient for intensive soothing. Decreases redness. - PROCERAD: Helps protect against the appearance of red or brown marks. Prevents post-acne marks. - ZINC: Reduces sebum and purifies the skin. Size:  1 Unit Fragrance:  NA KEY FEATURES  • Targets excess sebum • Targets blind pimples, pimples under the skin, blemishes, clogged pores and marks • Non-comedogenic: Formulas will not clog pores • A simple 2-step routine • Allergy tested","Ingredients
609579 39 - INGREDIENTS: AQUA / WATER •  SODIUM LAURETH SULFATE •  PEG-8 •  COCO-BETAINE •  HEXYLENE GLYCOL •  SODIUM CHLORIDE •  PEG-120 METHYL GLUCOSE DIOLEATE •  ZINC PCA •  SODIUM HYDROXIDE •  CAPRYLYL GLYCOL •  CITRIC ACID •  SODIUM BENZOATE •  PHENOXYETHANOL •  PARFUM / FRAGRANCE (F.I.L. B193153/1).Please be aware that ingredient lists for the products of our brand are updated regularly. Please refer to the ingredient list on your product package for the most up to date list of ingredients to ensure it is suitable to your personal use.",$13.69$6.26 Off RRP!,https://www.chemistwarehouse.com.au/buy/78820/la-roche-posay-effaclar-anti-acne-starter-kit
36,La Roche-Posay Thermal Spring Water Mist 300ml,"Hydrating face mist to help support sensitive skin.  La Roche-Posay Thermal Spring Water is sourced from the N°1 thermal dermatology centre in Europe, which has received over 450,000 patients for skin conditions since its establishment in 1905. This refreshing mist of thermal spring water contains a combination of minerals and trace elements. The water contains unique properties that are antioxidant, prebiotic, skin softening and soothing, to help rebalance the skin's microbiome and reinforce the skin. La Roche-Posay Thermal Spring Water delivers an ultra-fine mist that allows micro-droplets of water to instantly penetrate skin. RICH IN SELENIUM Selenium is a trace element which is essential for human biological equilibrium. La Roche-Posay Thermal spring water enjoys a natural high concentration of Selenium, which gives it unparalleled properties. Size:  300ml Fragrance:  NA KEY FEATURES  • This light mist contains a unique composition of minerals and trace elements, such as Selenium, giving the La Roche-Posay Thermal Spring Water scientifically-proven soothing, softening and anti-oxidant properties. • Protects, Soothes, Refreshes and Softens • For Adults, Children, Babies and Newborns","Ingredients
609025 - INGREDIENTS: AQUA / WATER (F.I.L. B3060/3).Please be aware that ingredient lists for the products of our brand are updated regularly. Please refer to the ingredient list on your product package for the most up to date list of ingredients to ensure it is suitable to your personal use.",$19.39$8.56 Off RRP!,https://www.chemistwarehouse.com.au/buy/78841/la-roche-posay-thermal-spring-water-mist-300ml
37,La Roche Posay Cicaplast B5 Repair Serum 30ml,"Dermatological hydrating repair serum for dry, sensitive skin.  The Cicaplast B5 Ultra Repair Serum is La Roche Posay's first dermatological serum with 10% Vitamin B5. With an efficient hydrating formula, the Cicaplast B5 Ultra Repair Serum has been specifically developed for dry skin prone to redness, skin tightness or discomfort. When used daily, the dry skin serum helps to hydrate and maintain the skin moisture barrier. Enriched with a highly concentrated humectant Vitamin B5 to help increase hydration and reduce trans-epidermal water loss, the skin repair serum formula also contains HEPES to help stimulate skin renewal, reinforce the moisture barrier, and comfort skin. The formula includes ingredients that are known to support the skin against everyday environmental aggressors like air pollution, temperature changes, low humidity and dryness. It also helps with topical irritations such as over-use of active ingredients and superficial skin procedures. The combination of hydrating and repair ingredients is also beneficial for skin impacted by lifestyle changes (lack of sleep, stress, poor diet). • 	La Roche-Posay have formulated this Cicaplast serum for dry and sensitive skin, however it is ideal to use on all skin types. • 	Use the skin repair serum daily for best results. • 	Suitable for use on post-superficial skin procedures on face. The La Roche-Posay Cicaplast serum for dry skin has been dermatologically tested to ensure suitability of the serum for sensitive skin types. The formula is hypoallergenic, fragrance free and non-comedogenic making it suitable for all skin types that need the added hydration and skin moisture barrier support. TEXTURE The Cicaplast B5 Repair Serum Is: • 	Lightweight • 	Fast absorbing • 	Non-sticky finish • 	Silky and Non-greasy texture Please note, the skin repair serum forms a protective film on the skin upon application, however, can ensure a non-sticky lightweight feel to the skin. KEY INGREDIENTS Repairing - 10% Vitamin B5 - Also known as Panthenol, Vitamin B5 is a humectant that attracts moisture from its surroundings and is able to lock in moisture within the skin. Vitamin B5 for skin is used to help support and maintain the skin moisture barrier. Due to its capability to attract and retain moisture, using Vitamin B5 helps soften skin, keeping it moist and helps prevent dryness. Vitamin B5 supports the skin moisture barrier through hydration, and reduces trans-epidermal water loss (TEWL), helping to reduce dryness and associated itchiness and discomfort. 10% Vitamin B5 has been added to the repair serum formula to hydrate and repair dry sensitive skin. Refining - HEPES - HEPES helps to gently exfoliate dead skin cells that are bound to the surface of the skin, refining clogged pores and uneven texture resulting in a smoother skin texture. HEPES has been used in the formulation to help even skin tone and refine skin texture. Soothing - Aqua Posae Filiformis (APF) - This prebiotic skincare is used to help rebalance the skin microbiome. Size:  30ml Fragrance:  NA KEY FEATURES  • The key benefit of this serum for dry skin is that it provides 24 hour hydration* • 2 x faster skin moisture barrier recovery in 1 hour** • 79% reduction in visible flaking and dryness in 1 hour** • The skin repair serum is proven to hydrate and repair sensitive feeling skin • Suitable for use on skin after post-superficial procedure","Ingredients
2039067 03 - INGREDIENTS: AQUA / WATER / EAU •  PANTHENOL •  GLYCERIN •  ALCOHOL DENAT. •  DIMETHICONE •  HYDROXYETHYLPIPERAZINE ETHANE SULFONIC ACID •  PEG-20 METHYL GLUCOSE SESQUISTEARATE •  SODIUM HYALURONATE •  AMMONIUM POLYACRYLOYLDIMETHYL TAURATE •  CAPRYLYL GLYCOL •  VITREOSCILLA FERMENT •  CITRIC ACID •  XANTHAN GUM •  OCTYLDODECANOL •  TOCOPHEROL •  PHENOXYETHANOL (F.I.L. T284947/1).Please be aware that ingredient lists for the products of our brand are updated regularly. Please refer to the ingredient list on your product package for the most up to date list of ingredients to ensure it is suitable to your personal use.",$45.99$19.96 Off RRP!,https://www.chemistwarehouse.com.au/buy/120001/la-roche-posay-cicaplast-b5-repair-serum-30ml
38,La Roche-Posay Lipikar Syndet AP+ Cream Wash 400ml,"Cleansing hand & body wash for dry to very dry, sensitive skin  Lipikar Syndet AP+ Wash Cream 400mL is a cleansing hand and body wash. This body cream cleanser and gel wash is formulated for dry to very dry sensitive skin. Lipikar Syndet AP+ Wash Cream features a nourishing cream-gel formulation that helps reduce dryness starting in the shower and from washing our hands. This body wash cream is ideal for sensitive, dry to very dry skin. Suitable for adults, babies and children. Contains calming La Roche-Posay Thermal Spring Water that is naturally soothing. Dermatologically tested on sensitive skin, Lipikar Syndet AP+ Wash Cream is soap-free and fragrance-free. Suitable even for newborns. Lipikar Syndet AP+ Wash Cream has a cleansing cream-gel formula that gently foams. We recommend using a lipid-replenishing body balm after cleansing, such as Lipikar AP+ M Body Balm. Key Ingredients: - AQUA POSAE - FILIFORMIS: Exclusive patented ingredient, to act on determining factors for extremely dry skin and space out flare-ups of severe dryness. - SHEA BUTTER: A key ingredient in all of the LIPIKAR formulas, Shea Butter is renowned for its ability to restore the skin's hydrolipidic film with lipids similar to skin's own. - NIACINAMIDE: An anti-inflammatory active ingredient. It soothes itching sensations. It also stimulates the synthesis of lipids within the skin. Suitable for atopic skin. Ingredients: AQUA / WATER •  GLYCERIN •  SODIUM LAURETH SULFATE •  PEG-200 •  HYDROGENATED GLYCERYL PALMATE •  COCO-BETAINE •  POLYSORBATE 20 •  CITRIC ACID •  PEG-7 •  GLYCERYL COCOATE •  NIACINAMIDE •  ACRYLATES COPOLYMER •  BUTYROSPERMUM PARKII BUTTER / SHEA BUTTER •  COCAMIDE MEA •  DISODIUM EDTA •  GLYCOL DISTEARATE •  MANNOSE •  POLYQUATERNIUM-11 •  SODIUM BENZOATE •  SODIUM CHLORIDE •  SODIUM HYDROXIDE •  VITREOSCILLA FERMENT (C223382/1) Please be aware that ingredient lists for the products of our brand are updated regularly. Please refer to the ingredient list on your product package for the most up to date list of ingredients to ensure it is suitable to your personal use. Size:  400ml Fragrance:  NA KEY FEATURES  • Dermatologically tested on sensitive skin • Soap-free and fragrance-free • Suitable for adults, children, babies and even newborns • Contains La Roche-Posay Thermal Spring Water that is naturally soothing • Helps reduce dryness starting in the shower and from washing our hands","Ingredients
714238 60 - INGREDIENTS: AQUA / WATER / EAU •  GLYCERIN •  SODIUM LAURETH SULFATE •  PEG-200 HYDROGENATED GLYCERYL PALMATE •  COCO-BETAINE •  POLYSORBATE 20 •  CITRIC ACID •  PEG-7 GLYCERYL COCOATE •  NIACINAMIDE •  DISODIUM EDTA •  MANNOSE •  SODIUM HYDROXIDE •  VITREOSCILLA FERMENT •  BUTYROSPERMUM PARKII BUTTER / SHEA BUTTER •  GLYCOL DISTEARATE •  ACRYLATES COPOLYMER •  COCAMIDE MEA •  POLYQUATERNIUM-11 •  SODIUM CHLORIDE •  SODIUM BENZOATE (F.I.L. N286701/1).Please be aware that ingredient lists for the products of our brand are updated regularly. Please refer to the ingredient list on your product package for the most up to date list of ingredients to ensure it is suitable to your personal use.",$26.39$11.56 Off RRP!,https://www.chemistwarehouse.com.au/buy/78827/la-roche-posay-lipikar-syndet-ap-cream-wash-400ml
